{"ticker":"AAPL","thesis":"Mock: stabilan rast uz visoke marže i snažan servisni segment; valuacija iznad prosjeka ostavlja malo prostora za razočaranja.","metrics":{"price":227.5,"pe":33.1,"revenue_growth_yoy":0.06,"net_margin":0.248},"risks":[{"text":"Ovisnost o lancu nabave u Aziji.","source":"10-K 2025, Item 1A"},{"text":"Regulatorni pritisak na App Store.","source":"10-K 2025, Item 1A"}],"peers":[],"sources":[{"label":"SEC EDGAR 10-K","url":"https://www.sec.gov/"},{"label":"Yahoo Finance","url":"https://finance.yahoo.com/quote/AAPL"}],"generated_at":"2026-10-05T12:00:00Z"}
